{
  "$id": "urn:ratatoskr:contracts:events:v1:SiteApprovalChanged",
  "$schema": "https://json-schema.org/draft/2020-12/schema",
  "title": "SiteApprovalChanged",
  "description": "Payload of `platform.site_approval.changed.v1`: the owner approved or withdrew the manifest of\none site.\n\nA fact. Platform writes it with the row of `identity.site_approvals` in one transaction, once\nper change, and `ratatoskr-sites` keeps a read projection of it (workspace spec\n`site-manifest`). A withdrawal repeats the digest, the capabilities and the hostname of the\napproval it ends. The enclosing envelope carries the owner as `tenant_id` and the aggregate\n`site:<site_id>`.\n\n`Deserialize` is hand-written because `capabilities` must hold each capability once.",
  "type": "object",
  "properties": {
    "capabilities": {
      "description": "The capabilities of the approved manifest, each once.",
      "type": "array",
      "items": {
        "$ref": "#/$defs/SiteCapability"
      },
      "uniqueItems": true
    },
    "github_repository": {
      "description": "The repository identity covered by this approval. Absent only for legacy documents;\nits absence grants no deploy authority (workspace SITE-028).",
      "anyOf": [
        {
          "$ref": "#/$defs/GitHubRepositoryBinding"
        },
        {
          "type": "null"
        }
      ]
    },
    "hostname": {
      "description": "The hostname of the approved manifest.",
      "$ref": "#/$defs/Hostname"
    },
    "manifest_sha256": {
      "description": "The lowercase hex SHA-256 of the manifest bytes that the approval names.",
      "$ref": "#/$defs/DigestHex"
    },
    "site_id": {
      "description": "The site whose approval changed.",
      "$ref": "#/$defs/SiteId"
    },
    "state": {
      "description": "Whether the approval is now in force.",
      "$ref": "#/$defs/ApprovalState"
    }
  },
  "additionalProperties": false,
  "required": [
    "capabilities",
    "hostname",
    "manifest_sha256",
    "site_id",
    "state"
  ],
  "x-ratatoskr-provenance": {
    "canonical_source": "ratatoskr_sites_contracts::SiteApprovalChanged",
    "contract_id": "platform.site_approval_changed",
    "contract_major_version": 1,
    "generated": "DO NOT EDIT — generated by contractsc from the canonical Rust source. Change the Rust type and run `cargo contracts generate`.",
    "generator": "contractsc",
    "generator_version": "0.1.0",
    "schemars_version": "1.2.2",
    "source_digest": "sha256:a1088d99a5630a85cb414e0ed359a879a619aca3d10ab498f055c4aa533d99dc",
    "validation_note": "This schema is a LOWER BOUND on validity. Cross-field invariants and canonical-form rules are enforced by the canonical Rust type; see fixtures/invalid-expectations.toml for which layer rejects what."
  },
  "$defs": {
    "ApprovalState": {
      "description": "Whether a site approval is in force.",
      "oneOf": [
        {
          "description": "The owner approved the manifest digest; it is the approved manifest of the site.",
          "type": "string",
          "const": "approved"
        },
        {
          "description": "The owner withdrew the approval; the site serves nothing.",
          "type": "string",
          "const": "withdrawn"
        }
      ]
    },
    "DigestHex": {
      "title": "DigestHex",
      "description": "Lowercase hexadecimal bytes of a content digest.",
      "type": "string",
      "examples": [
        "0000000000000000000000000000000000000000000000000000000000000000"
      ],
      "maxLength": 64,
      "pattern": "^[0-9a-f]{64}$"
    },
    "GitHubRepositoryBinding": {
      "description": "One repository whose signed builds the owner approves for a site.\n\nBoth fields are part of the manifest digest and the approval event. A changed name or id needs\na new owner approval. Absence in a legacy manifest grants no deploy authority.",
      "type": "object",
      "properties": {
        "repository": {
          "description": "The canonical public GitHub repository name that the owner approves.",
          "$ref": "#/$defs/GitHubRepositoryName"
        },
        "repository_id": {
          "description": "Its immutable GitHub repository id; a reused name does not keep this identity.",
          "$ref": "#/$defs/GitHubRepositoryId"
        }
      },
      "additionalProperties": false,
      "required": [
        "repository",
        "repository_id"
      ]
    },
    "GitHubRepositoryId": {
      "title": "GitHubRepositoryId",
      "description": "The immutable positive GitHub repository id, in decimal with no leading zero.\n\nA string keeps the exact integer in generated JavaScript clients. This is public identity,\nnot a credential. Verification compares it with the signed certificate claim.",
      "type": "string",
      "examples": [
        "1420131804"
      ],
      "maxLength": 20,
      "pattern": "^[1-9][0-9]{0,19}$"
    },
    "GitHubRepositoryName": {
      "title": "GitHubRepositoryName",
      "description": "The canonical lower-case GitHub repository in an approval, as `owner/name`.\n\nIt names one public GitHub repository. The numeric id also has to match its signed identity.",
      "type": "string",
      "examples": [
        "owner/docs-site"
      ],
      "maxLength": 140,
      "pattern": "^[a-z0-9][a-z0-9-]{0,38}/[a-z0-9._-]{1,100}$"
    },
    "Hostname": {
      "title": "Hostname",
      "description": "The DNS hostname that serves a site, in lower case, without a scheme, a port or a final dot.\n\nTwo or more labels separated by `.`; each label has 1 to 63 lower-case ASCII letters,\ndigits and `-`, and does not start or end with `-`. At most 253 characters.",
      "type": "string",
      "examples": [
        "docs.example.test",
        "garden.example.test"
      ],
      "maxLength": 253,
      "pattern": "^[a-z0-9](?:[a-z0-9-]{0,61}[a-z0-9])?(?:\\.[a-z0-9](?:[a-z0-9-]{0,61}[a-z0-9])?)+$"
    },
    "SiteCapability": {
      "description": "One capability that a site manifest can request.\n\n**Closed on purpose** (workspace spec `site-manifest`, \"Capabilities are a closed set with a\nfixed audience\"): a manifest that names any other value is refused. The first four are\navailable to an anonymous visitor; the other four only to a `site_owner` session.",
      "oneOf": [
        {
          "description": "Read the pages and the navigation of the current release. Anyone.",
          "type": "string",
          "const": "pages.read"
        },
        {
          "description": "Read the assets of the current release. Anyone.",
          "type": "string",
          "const": "assets.read"
        },
        {
          "description": "Full-text search over the current release only. Anyone.",
          "type": "string",
          "const": "search.publication"
        },
        {
          "description": "Receive `release.published` events over SSE. Anyone.",
          "type": "string",
          "const": "live.release"
        },
        {
          "description": "Read unpublished changes of the site's publications. Owner session only.",
          "type": "string",
          "const": "draft.read"
        },
        {
          "description": "Write the source notes of the site's publications. Owner session only.",
          "type": "string",
          "const": "notes.edit"
        },
        {
          "description": "Read the owner's knowledge library. Owner session only.",
          "type": "string",
          "const": "library.read"
        },
        {
          "description": "Search across the owner's knowledge, not only the publication. Owner session only.",
          "type": "string",
          "const": "knowledge.search"
        }
      ]
    },
    "SiteId": {
      "title": "SiteId",
      "description": "The id of one site: 3 to 40 lower-case ASCII letters, digits and `-`.\n\nThe grammar is the `site:<site id>` form of `WriteOrigin` in `ratatoskr-notes-contracts`.\nThe owner chooses the id, and it appears in every route under `/v1/sites/{site}/`.",
      "type": "string",
      "examples": [
        "docs",
        "garden-2026"
      ],
      "maxLength": 40,
      "pattern": "^[a-z0-9-]{3,40}$"
    }
  }
}
